date,summary,overall_sentiment,key_points
2024-08-01,"The overall sentiment for the day is blend of mixed sentiments, although the majority do lean towards a positive trend. Most of the news items are about Apple's Q3 earnings and its move to dismiss a US antitrust lawsuit. There is also news on other tech stock investments and the Federal Guidance impacting markets. Market movements are being influenced by corporate earnings from tech sector giants such as Apple and Amazon, while there are also concerns about possible reductions in September's rates.",Mixed,"['Dow Jones futures fall as certain tech companies like Apple, Amazon, and Nvidia do not meet market expectations, whilst a rise is observed based on jobless claims.', 'Markets reportedly tumbled due to concerns about a potential recession, significantly influenced by the earnings from Apple, Amazon, and INTC.', 'Apple outperformed its June-quarter targets, mainly due to high demand for its services and iPad sales.', 'Apple took steps to dismiss a US antitrust lawsuit, claiming it has no relation to reality.', 'Investment advice suggests buying three specific Warren Buffet stocks, avoiding Bank of America, and looking out for three particular financial stocks in August.', 'There are soaring hopes for a rate cut in September which affects tech stocks investments.', ""Apple and Amazon's Q3 earnings will significantly impact the next moves for Nasdaq 100.""]"
2024-08-02,"On August 2, 2024, majority of the headlines focused on Apple's Q3 results, with its stock holding steady despite a drop in iPhone sales. Market narratives leaned towards a negative sentiment, partly due to correction territory reported for Nasdaq 100 as AI stocks stumbled. However, Apple's increased focus on AI features and services growth balancing lower iPhone sales provided a boost. Notable mentions included Warren Buffett's investment holdings and his long-haul stock recommendations.",Neutral,"[""Apple's stock stability amid lower iPhone sales and Q3 earnings beat forecasts."", 'Nasdaq 100 entering correction territory with AI stocks sinking, reflecting market anxiety.', ""Growth in Apple's services compensating for lower iPhone sales, which is perceived positively and forecasts potential future growth."", ""Warren Buffett's stock recommendations getting attention, including his past interaction with Steve Jobs on investment advice."", 'Investment in AI by big tech companies, which is becoming significant, despite some companies seeing dips in their stock values.']"
2024-08-05,"The major theme in the news today was the significant selloff in the tech sector, paired with negative economic predictions. Specifically, the reports highlight a sharp decline in tech stocks, resulting in losses of billions of dollars in market value. News about Warren Buffett’s Berkshire Hathaway cutting its stake in Apple added to these negative sentiments. Furthermore, Google losing an antitrust lawsuit adds potential risks for big tech companies. However, within this environment, future possibilities with AI and 6G technology, and opportunities to buy are also being discussed.",Negative,"[""Warren Buffett's Berkshire Hathaway has reportedly reduced its stake in Apple Inc."", 'Tech stocks, particularly Apple and Nvidia, suffer considerable losses in a market selloff.', 'Google lost an antitrust case, which could have significant consequences for big tech.', 'Despite the negative sentiment, there are discussions about the future potential of AI and 6G technology.', 'Bargain hunting advice is being given despite the current market panic.']"
2024-08-06,"The tech industry, and especially the trial and potential consequences for giants Google and Apple, dominated today's news sentiment. There was increased focus on the Google antitrust case, which could affect the future of search engines. A significant portion of the news suggested negative repercussions, not for Google alone, but also for other tech companies like Apple and Mozilla. In stocks, Warren Buffett's decision to sell a significant portion of Apple's shares generated negative sentiment. On the other hand, the possible rate cuts led to positive sentiment for some stocks.",Mixed,"[""Google's antitrust verdict continues to influence market sentiment, with a risk of shattering Google's market dominance."", ""Warren Buffet reducing his stake in Apple caused negative sentiment around Apple's stock."", 'Despite tech market uncertainty, select stock opportunities were identified, such as Palantir, Nvidia, Uber, and others.', 'Investment trends indicated a pivot away from tech and towards the Dow, signaling potential market shifts.', 'Market dips were generally seen as buying opportunities, balancing some of the negative news sentiment.']"
2024-08-07,"Today's news highlights a strong focus on AI and its influence on the tech and stock markets. Popular topics included the growth potential of AI-focused stocks, Big Tech’s investments in AI, and the future of Apple in the wake of Warren Buffet's significant stock sell-off. The overall sentiment trend is positive, despite some bearish market rotations and analyst debates.",Positive,"['Market is rotating to traditional Dow Jones components, suggesting possible dumping of certain stocks.', 'AI-focused stocks are being highly discussed, with a suggestion that they may shape the future of technology.', 'Big tech companies, including Microsoft, Google, Meta, Amazon, and Apple, are heavily investing in AI.', 'European users are expected to gain access to Apple Intelligence.', 'JPMorgan has raised its price target on certain stocks.', 'Growth is anticipated in data center stocks due to surging AI demand.', 'Debate continues over the best stock buy between Amazon and Apple.', 'Apple Inc. may not receive the ‘Benefit of the Doubt’ from the market, according to Jim Cramer.', 'Warren Buffet has sold a significant amount of Apple stocks, leading to speculation regarding potential investment mistakes.', 'The Nasdaq market correction has highlighted specific stocks to buy and avoid.', ""There's a noticeable trend in politician-led stock buying and selling."", ""Considerable discussion on the implications of Buffet's decision to slash AAPL holdings.""]"
