final_action,final_confidence,explanations,date,tic
buy,0.85,"[TechnicalAnalystAgent] hold (0.7): Based on the technical indicators, the MACD is positive indicating a potential uptrend, but the RSI is neutral around 55. The CCI is negative suggesting a slight bearish sentiment. The 30-day SMA is slightly above the current price, while the 60-day SMA is below. The DMI is positive but not strongly indicating a clear trend. Therefore, it is advisable to hold the position for now until a clearer trend emerges.
[SentimentAnalystAgent] hold (0.7): The mixed sentiment and news surrounding Apple indicate potential volatility in the short term. Positive news about Apple's performance and beating targets is balanced by negative sentiments related to court news and market uncertainties. It is advisable to hold the stock for now and monitor the upcoming earnings report and market developments closely before making any buying or selling decisions.
[MacroAnalystAgent] buy (0.85): The company has shown robust performance this quarter with revenue growth surpassing market expectations, indicating strong potential for future growth. Additionally, the increase in R&D expenditure suggests a focus on innovation and long-term sustainability. With a stable financial health and healthy cash reserves, the company is well-positioned to capitalize on growth opportunities in the market.
[RiskAnalystAgent] hold (0.8): The VIX is relatively low at 18.59, indicating moderate market volatility. However, the Market Turbulence Index is high at 80.65, suggesting a high level of turbulence and risk in the market. It would be prudent to take a conservative approach and hold off on buying or selling until the market turbulence subsides.",2024-08-01,AAPL
hold,0.8,"[TechnicalAnalystAgent] hold (0.8): Based on the historical data and current indicators, the stock is showing stability with minor fluctuations. The MACD and RSI values are close to previous levels, indicating a neutral trend. It is advisable to hold the position and monitor for further developments before making a decision to buy or sell.
[SentimentAnalystAgent] buy (0.7): Despite a decline in iPhone sales, Apple's Q3 earnings beat estimates due to growth in other services, indicating resilience and potential for upside. Analysts are optimistic about Apple's AI features and multi-year upgrade cycle driving future growth. Mixed sentiment in the tech sector and Asian stock market slump may create short-term volatility, but Warren Buffett's long-haul stocks are highlighted as a viable consideration, signaling stability and potential long-term gains.
[MacroAnalystAgent] buy (0.8): Based on the historical data from 2024-08-01, the company showed robust performance with strong revenue growth, increased R&D expenditure to boost innovation capabilities, and maintained a healthy financial condition. Considering these factors, it is recommended to buy AAPL stock.
[RiskAnalystAgent] sell (0.8): Based on the increase in both VIX and market turbulence index compared to historical data, the current risk level of the market is elevated. It is recommended to take a conservative approach and consider selling positions to mitigate potential losses.",2024-08-02,AAPL
hold,0.8,"[TechnicalAnalystAgent] sell (0.8): Based on the historical data, the MACD has decreased from previous days indicating a potential bearish trend. The RSI is below 50, indicating a weakening of the stock's momentum. Additionally, the current CCI is significantly negative, suggesting an oversold condition. The closing price is below both the 30-day and 60-day simple moving averages, indicating a potential downtrend. Therefore, it is recommended to sell with high confidence.
[SentimentAnalystAgent] sell (0.8): The negative news surrounding the tech sector, including Apple's significant selloff and Warren Buffett's reduction in stake, indicates a potential short-term downward movement in Apple's stock. Investor concerns over economic downturn and skepticism about Apple's future performance may lead to further selling pressure. It is advisable to sell Apple stock in the short term to mitigate potential losses.
[MacroAnalystAgent] hold (0.8): Based on the historical data from 2024-08-01, the company showed robust performance with strong revenue growth, increased R&D expenditure for innovation, and maintained a healthy financial condition. Due to the positive indicators, it is recommended to hold the stock for now.
[RiskAnalystAgent] sell (0.75): Based on the increase in VIX and turbulence index from the historical data to the current values, the market risk has significantly escalated. The higher VIX and turbulence indicate increased volatility and uncertainty, suggesting a higher risk level. Therefore, it is advisable to take a conservative approach and consider selling to mitigate potential losses.",2024-08-05,AAPL
